mysql> create database company_db;
Query OK, 1 row affected (0.01 sec)

mysql> use company_db;
Database changed
mysql> CREATE TABLE employees (
    ->     emp_id INT PRIMARY KEY,
    ->     emp_name VARCHAR(50),
    ->     department VARCHAR(30),
    ->     salary DECIMAL(10,2),
    ->     join_date DATE
    -> );
Query OK, 0 rows affected (0.02 sec)

mysql> INSERT INTO employees VALUES
    -> (101, 'Arun', 'IT', 30000, '2023-06-10'),
    -> (102, 'Meena', 'HR', 25000, '2022-03-15'),
    -> (103, 'Ravi', 'Finance', 28000, '2021-12-01');
Query OK, 3 rows affected (0.01 sec)
Records: 3  Duplicates: 0  Warnings: 0

mysql> SELECT * FROM employees;
+--------+----------+------------+----------+------------+
| emp_id | emp_name | department | salary   | join_date  |
+--------+----------+------------+----------+------------+
|    101 | Arun     | IT         | 30000.00 | 2023-06-10 |
|    102 | Meena    | HR         | 25000.00 | 2022-03-15 |
|    103 | Ravi     | Finance    | 28000.00 | 2021-12-01 |
+--------+----------+------------+----------+------------+
3 rows in set (0.00 sec)

mysql> SELECT emp_name, salary 
    -> FROM employees 
    -> WHERE department = 'IT';
+----------+----------+
| emp_name | salary   |
+----------+----------+
| Arun     | 30000.00 |
+----------+----------+
1 row in set (0.00 sec)

mysql> UPDATE employees
    -> SET salary = salary + 5000
    -> WHERE department = 'IT';
Query OK, 1 row affected (0.01 sec)
Rows matched: 1  Changed: 1  Warnings: 0

mysql> 
mysql> DELETE FROM employees
    -> WHERE emp_id = 103;
Query OK, 1 row affected (0.01 sec)

mysql> INSERT INTO employees VALUES
    -> (104, 'Kiran', 'Finance', 32000, '2022-08-12'),
    -> (105, 'Divya', 'HR', 27000, '2023-01-20'),
    -> (106, 'Manoj', 'IT', 35000, '2021-11-05'),
    -> (107, 'Priya', 'Marketing', 26000, '2022-05-18'),
    -> (108, 'Suresh', 'Finance', 30000, '2024-02-01');
Query OK, 5 rows affected (0.00 sec)
Records: 5  Duplicates: 0  Warnings: 0

mysql> SELECT * 
    -> FROM employees
    -> WHERE department = 'HR';
+--------+----------+------------+----------+------------+
| emp_id | emp_name | department | salary   | join_date  |
+--------+----------+------------+----------+------------+
|    102 | Meena    | HR         | 25000.00 | 2022-03-15 |
|    105 | Divya    | HR         | 27000.00 | 2023-01-20 |
+--------+----------+------------+----------+------------+
2 rows in set (0.00 sec)

mysql> UPDATE employees
    -> SET salary = salary * 1.10
    -> WHERE department = 'Finance';
Query OK, 2 rows affected (0.00 sec)
Rows matched: 2  Changed: 2  Warnings: 0

mysql> DELETE FROM employees
    -> WHERE join_date < '2022-01-01';
Query OK, 1 row affected (0.00 sec)

mysql> SELECT * FROM employees;
+--------+----------+------------+----------+------------+
| emp_id | emp_name | department | salary   | join_date  |
+--------+----------+------------+----------+------------+
|    101 | Arun     | IT         | 35000.00 | 2023-06-10 |
|    102 | Meena    | HR         | 25000.00 | 2022-03-15 |
|    104 | Kiran    | Finance    | 35200.00 | 2022-08-12 |
|    105 | Divya    | HR         | 27000.00 | 2023-01-20 |
|    107 | Priya    | Marketing  | 26000.00 | 2022-05-18 |
|    108 | Suresh   | Finance    | 33000.00 | 2024-02-01 |
+--------+----------+------------+----------+------------+
6 rows in set (0.00 sec)

mysql> \T
Currently logging to file 'task03(dml&dql).txt'
mysql> exit
